{
  "id": "6f1c2a3e-6666-4a1a-8a1a-000000000001",
  "destinationId": "6f1c2a3e-5555-4a1a-8a1a-000000000001",
  "activity": "working",
  "attention": "none",
  "evidenceKind": "domSignal",
  "observedAt": "2026-10-08T07:00:00Z",
  "receivedAt": "2026-10-08T07:00:00Z",
  "expiresAt": "2026-10-08T07:00:15Z",
  "sequence": 5,
  "connectionEpoch": "epoch-1",
  "adapterVersion": "0.1.0"
}
